{
  "entries": [
    {
      "activeChangeId": null,
      "id": "deterministic-cross-platform-test-environment",
      "lastResolution": {
        "changeId": "extend-windows-natural-drain",
        "version": "0.5.1"
      },
      "publicSurfaces": [
        "cross-platform-tests",
        "verification-evidence"
      ],
      "reusableClass": "portability-gap",
      "status": "resolved"
    },
    {
      "activeChangeId": "enforce-evidence-valid-recommendations",
      "id": "failure-to-invariant-disposition-enforcement",
      "lastResolution": {
        "changeId": "federated-process-improvement",
        "version": "0.5.0"
      },
      "publicSurfaces": [
        "governance",
        "lifecycle",
        "recommendation",
        "skills"
      ],
      "reusableClass": "deterministic-enforcement",
      "status": "active"
    },
    {
      "activeChangeId": null,
      "id": "producer-improvement-route-completeness",
      "lastResolution": {
        "changeId": "federated-process-improvement",
        "version": "0.5.0"
      },
      "publicSurfaces": [
        "catalog",
        "lifecycle"
      ],
      "reusableClass": "deterministic-enforcement",
      "status": "resolved"
    },
    {
      "activeChangeId": null,
      "id": "single-windows-helper-protocol",
      "lastResolution": {
        "changeId": "fix-windows-verification-boundary",
        "version": "0.5.0"
      },
      "publicSurfaces": [
        "command-execution",
        "windows-supervision"
      ],
      "reusableClass": "deterministic-enforcement",
      "status": "resolved"
    }
  ],
  "kind": "engineering-process-improvement-catalog",
  "producer": {
    "project": "engineering-process",
    "repository": "phuongnse/engineering-process"
  },
  "schemaVersion": 1
}
