{
  "schemaVersion": 1,
  "kind": "engineering-process-improvement-catalog",
  "producer": {
    "project": "engineering-process",
    "repository": "example/engineering-process"
  },
  "entries": [
    {
      "id": "single-windows-helper-protocol",
      "reusableClass": "deterministic-enforcement",
      "status": "resolved",
      "publicSurfaces": [
        "command-execution",
        "windows-supervision"
      ],
      "lastResolution": {
        "changeId": "fix-windows-helper-protocol",
        "version": "0.5.0"
      },
      "activeChangeId": null
    }
  ]
}
